{
    "version": "0.66.0",
    "description": "Brings the power of Gemini directly into your terminal",
    "homepage": "https://geminicli.com",
    "license": "Apache-2.0",
    "depends": "nodejs-lts",
    "url": "https://github.com/google-gemini/gemini-cli/releases/download/v0.66.0/gemini-cli-bundle.zip",
    "hash": "670d0eeac3d71b3c9926511a2843d659493ef094071391d918a697248860acca",
    "bin": [
        [
            "node",
            "gemini",
            "$dir\\gemini.js"
        ]
    ],
    "checkver": {
        "github": "https://github.com/google-gemini/gemini-cli"
    },
    "autoupdate": {
        "url": "https://github.com/google-gemini/gemini-cli/releases/download/v$version/gemini-cli-bundle.zip"
    }
}
