{
    "homepage": "https://docs.microsoft.com/en-us/sysinternals/",
    "description": "Scan file shares on your network and view their security settings to close security holes.",
    "license": {
        "identifier": "Freeware",
        "url": "https://docs.microsoft.com/en-us/sysinternals/license-terms"
    },
    "version": "1.61",
    "url": "https://download.sysinternals.com/files/ShareEnum.zip",
    "hash": "7f88cabcf12a502e8242d5d1d899ee6d1ddec6642e56cbd6511a698827cbfcba",
    "checkver": {
        "url": "https://docs.microsoft.com/en-us/sysinternals/downloads/shareenum",
        "re": "ShareEnum\\s(?:v|V)?([\\d.]+)"
    },
    "autoupdate": {
        "url": "https://download.sysinternals.com/files/ShareEnum.zip"
    },
    "architecture": {
        "32bit": {
            "bin": "ShareEnum.exe",
            "shortcuts": [
                [
                    "ShareEnum.exe",
                    "SysInternals/ShareEnum",
                    "/accepteula"
                ]
            ]
        },
        "64bit": {
            "bin": "ShareEnum.exe",
            "shortcuts": [
                [
                    "ShareEnum.exe",
                    "SysInternals/ShareEnum",
                    "/accepteula"
                ]
            ]
        }
    }
}
