{
    "version": "1.2",
    "description": "Sordum's Fix Print Spooler. Fix casual problems with print spooler service.",
    "homepage": "https://www.sordum.org/9199/",
    "license": {
        "identifier": "Freeware",
        "url": "https://www.sordum.org/eula/"
    },
    "url": "https://www.sordum.org/files/small-tools/FixPrintSpooler.zip",
    "hash": "b6f8fc83c8c22febca0e1429a360911a45a135d29737a6e8449edaf4a3708bdb",
    "extract_dir": "FixPrintSpooler_v1.2",
    "architecture": {
        "64bit": {
            "bin": [
                "FixSpooler_x64.exe",
                [
                    "FixSpooler_x64.exe",
                    "FixSpooler"
                ]
            ],
            "shortcuts": [
                [
                    "FixSpooler_x64.exe",
                    "Sordum\\Fix Print Spooler"
                ]
            ]
        },
        "32bit": {
            "bin": "FixSpooler.exe",
            "shortcuts": [
                [
                    "FixSpooler.exe",
                    "Sordum\\Fix Print Spooler"
                ]
            ]
        }
    },
    "checkver": "v([\\d.]+)",
    "autoupdate": {
        "url": "https://www.sordum.org/files/small-tools/FixPrintSpooler.zip",
        "extract_dir": "FixPrintSpooler_v$version"
    }
}
