{
    "homepage": "https://git.irs.sh/KNOXDEV",
    "description": "Additional backup functionality for the Scoop Package Manager",
    "license": "Unlicense",
    "version": "0.2022.01.05",
    "url": "https://github.com/hu3rror/scoop-backup/archive/667c0b3bd0644a4955b6ccc6089a028faf9c12ba.zip",
    "hash": "d92ccab39b2b929ae49dab77d8e0d8394459b3b881d8187d50f13da64e8a165a",
    "extract_dir": "scoop-backup-667c0b3bd0644a4955b6ccc6089a028faf9c12ba",
    "bin": "scoop-backup.ps1",
    "persist": "backups"
}
