{
    "version": "0.21.1",
    "description": "A Prometheus exporter allows blackbox probing of endpoints over HTTP, HTTPS, DNS, TCP and ICMP.",
    "homepage": "https://github.com/prometheus/blackbox_exporter",
    "license": "Apache-2.0",
    "architecture": {
        "64bit": {
            "url": "https://github.com/prometheus/blackbox_exporter/releases/download/v0.21.1/blackbox_exporter-0.21.1.windows-amd64.tar.gz",
            "hash": "880c5d274705b063053ae2eb6b9449aa68b554f05687edfc1663eca18961b1f0",
            "extract_dir": "blackbox_exporter-0.21.1.windows-amd64"
        },
        "32bit": {
            "url": "https://github.com/prometheus/blackbox_exporter/releases/download/v0.21.1/blackbox_exporter-0.21.1.windows-386.tar.gz",
            "hash": "b527406701de94cd8c8731d8b1ba8616bf864f48ccb1927d23243b525b5acb2b",
            "extract_dir": "blackbox_exporter-0.21.1.windows-386"
        }
    },
    "persist": "blackbox.yml",
    "bin": "blackbox_exporter.exe",
    "checkver": "github",
    "autoupdate": {
        "architecture": {
            "64bit": {
                "url": "https://github.com/prometheus/blackbox_exporter/releases/download/v$version/blackbox_exporter-$version.windows-amd64.tar.gz",
                "extract_dir": "blackbox_exporter-$version.windows-amd64"
            },
            "32bit": {
                "url": "https://github.com/prometheus/blackbox_exporter/releases/download/v$version/blackbox_exporter-$version.windows-386.tar.gz",
                "extract_dir": "blackbox_exporter-$version.windows-386"
            }
        },
        "hash": {
            "url": "$baseurl/sha256sums.txt"
        }
    }
}
