{
    "homepage": "https://github.com/WereDev/Wu10Man",
    "version": "4.4.0",
    "license": "GPL-3.0-only",
    "url": "https://github.com/WereDev/Wu10Man/releases/download/v4.4.0/Wu10Man_Portable.zip",
    "hash": "58d0ae4eac8841b04f4c553fc80d4ecd80a89b9a7ff3481250ac2653cdb6aa17",
    "shortcuts": [
        [
            "Wu10Man.exe",
            "Wu10Man"
        ]
    ],
    "checkver": {
        "github": "https://github.com/WereDev/Wu10Man"
    },
    "autoupdate": {
        "url": "https://github.com/WereDev/Wu10Man/releases/download/v$version/Wu10Man_Portable.zip"
    }
}
