{
    "homepage": "http://pdm-project.org",
    "version": "2.29.5",
    "description": "Python package and dependency manager supporting the latest PEP standards",
    "license": "MIT",
    "url": "https://files.pythonhosted.org/packages/a7/ed/c73bc231225e9f5638fdfd3fc689feeb966e6f2be41ef9e93bbaaa9d2abf/pdm-2.29.5-py3-none-any.whl",
    "depends": "python",
    "hash": "78f6efa8359735002b6331183af7c4004098361d360843f0d54a5a6f92c8d9f3",
    "bin": "venv\\Scripts\\pdm.exe",
    "installer": {
        "script": [
            "python -m venv \"$dir\\venv\"",
            "& \"$dir\\venv\\Scripts\\python.exe\" -m pip install \"$dir\\$fname\""
        ]
    },
    "post_install": [
        "if (-not (Test-Path -Path $PROFILE\\..\\Completions -PathType Container)) {",
        "    mkdir $PROFILE\\..\\Completions",
        "    echo @'",
        "Get-ChildItem \"$PROFILE\\..\\Completions\\\" | ForEach-Object {",
        "    . $_.FullName",
        "}",
        "'@ | Out-File -Append -Encoding utf8 $PROFILE",
        "}",
        "& \"$dir\\venv\\Scripts\\pdm.exe\" completion powershell | Out-File -Encoding utf8 $PROFILE\\..\\Completions\\pdm_completion.ps1"
    ],
    "uninstaller": {
        "script": [
            "$oldPath = [Environment]::GetEnvironmentVariable(\"PYTHONPATH\", [System.EnvironmentVariableTarget]::User)",
            "If (-not [string]::IsNullOrWhiteSpace($oldPath)) {",
            "    $newPath = ($oldPath.Split(';') | Where { $_ -notlike \"$dir\\venv\\*\" }) -join ';'",
            "    [Environment]::SetEnvironmentVariable(\"PYTHONPATH\", $newPath, [System.EnvironmentVariableTarget]::User)",
            "}",
            "Remove-Item -Path $PROFILE\\..\\Completions\\pdm_completion.ps1 -ErrorAction SilentlyContinue"
        ]
    },
    "checkver": {
        "url": "https://pypi.org/pypi/pdm/json",
        "jp": "$.urls[?(@.packagetype == 'bdist_wheel')].url",
        "re": "https://files.pythonhosted.org/packages/(.*/pdm-(?<version>[\\d.]+(?:post\\d+)?)-.*\\.whl)",
        "replace": "${version}"
    },
    "autoupdate": {
        "url": "https://files.pythonhosted.org/packages/$match1"
    }
}
