{
    "version": "6.9.0",
    "description": "Multi platform circuit layout and schematic drawing tool.",
    "homepage": "https://bancika.github.io/diy-layout-creator/",
    "license": "GPL-3.0-or-later",
    "notes": "User configuration, backups, and log files are stored in \"%USERPROFILE%\\diylc\", and are not persisted by Scoop.",
    "architecture": {
        "64bit": {
            "url": "https://github.com/bancika/diy-layout-creator/releases/download/v6.9.0/diylc-6.9.0-win64.zip",
            "hash": "37d2a6707dd65ee4c32ac342c8f4e441f3607ef12f61e129fc845918f5c19260"
        }
    },
    "shortcuts": [
        [
            "diylc.exe",
            "DIY Layout Creator"
        ]
    ],
    "checkver": {
        "github": "https://github.com/bancika/diy-layout-creator"
    },
    "autoupdate": {
        "architecture": {
            "64bit": {
                "url": "https://github.com/bancika/diy-layout-creator/releases/download/v$version/diylc-$version-win64.zip"
            }
        }
    }
}
