{
    "version": "1.10",
    "description": "BTRFS filesystem driver.",
    "homepage": "https://github.com/maharmstone/btrfs",
    "license": "LGPL-3.0-or-later",
    "notes": [
        "If you using Windows 10 and have Secure Boot enabled, you may have to make a registry change in order for the driver to be loaded.",
        "See https://github.com/maharmstone/btrfs#secureboot."
    ],
    "url": "https://github.com/maharmstone/btrfs/releases/download/v1.10/btrfs-1.10.zip",
    "hash": "82303494b4fd4c23ad7c6fd69a886cb1a317a0293ee6e283b7c009117133b0c3",
    "pre_install": "if (!$global) { Write-Host -Foreground Red \"$app should be installed globally.\"; break }",
    "installer": {
        "script": [
            "using namespace System.Security.Cryptography.X509Certificates",
            "# Add cert first before installing driver",
            "$cert = (Get-AuthenticodeSignature \"$dir/btrfs.cat\").SignerCertificate",
            "if (!(Get-ChildItem Cert:/CurrentUser/TrustedPublisher -Recurse | Where-Object { $_.Thumbprint -eq $cert.Thumbprint })) {",
            "    Write-Host 'Cert not found, adding to trusted store...'",
            "    $store = [X509Store]::new([StoreName]::TrustedPublisher, [StoreLocation]::LocalMachine)",
            "    $store.Open([OpenFlags]::ReadWrite)",
            "    $store.Add($cert.Export([X509ContentType]::Cert))",
            "    $store.Close()",
            "}",
            "",
            "Write-Host 'Installing driver...'",
            "$null = Invoke-ExternalCommand pnputil.exe -ArgumentList @('/add-driver', \"$dir/btrfs.inf\", '/install') -RunAs -ContinueExitCodes @{ 3010 = 'A system reboot is required to finalize the installation.' }"
        ]
    },
    "post_install": [
        "Set-ItemProperty HKLM:/SYSTEM/CurrentControlSet/Services/btrfs Compress 1",
        "Set-ItemProperty HKLM:/SYSTEM/CurrentControlSet/Services/btrfs CompressType 3"
    ],
    "uninstaller": {
        "script": [
            "if ($cmd -ne 'uninstall') { return }",
            "$null = Invoke-ExternalCommand pnputil.exe -ArgumentList @('/remove-device', 'ROOT\\btrfs\\0000') -RunAs -ContinueExitCodes @{ 3010 = 'A system reboot is required to finalize the uninstallation.' }",
            "$null = pnputil.exe /delete-driver \"$dir\\btrfs.inf\" /uninstall",
            "$null = pnputil.exe /delete-driver \"$dir\\btrfs-vol.inf\" /uninstall",
            "$null = sc.exe delete btrfs"
        ]
    },
    "checkver": "github",
    "autoupdate": {
        "url": "https://github.com/maharmstone/btrfs/releases/download/v$version/btrfs-$version.zip"
    }
}
