{
    "version": "0.11.37",
    "description": "An interface to Plebbit API through command line.",
    "homepage": "https://github.com/plebbit/plebbit-cli",
    "license": "GPL-2.0-only",
    "architecture": {
        "64bit": {
            "url": "https://github.com/plebbit/plebbit-cli/releases/download/v0.11.37/plebbit_installer_win32_x64.exe#/dl.7z",
            "hash": "7997183d07b3c05ffd7ce38ca11ea28e86d38a339076b86b5e78271ba1130e7d"
        }
    },
    "post_install": "Remove-Item \"$dir\\`$PLUGINSDIR\", \"$dir\\Uninstall*\" -Force -Recurse",
    "bin": [
        [
            "client\\bin\\node.exe",
            "plebbit",
            "$dir\\client\\bin\\run"
        ]
    ],
    "notes": "Default directory where plebbit-cli will keep its config: %LOCALAPPDATA%\\plebbit",
    "checkver": "github",
    "autoupdate": {
        "architecture": {
            "64bit": {
                "url": "https://github.com/plebbit/plebbit-cli/releases/download/v$version/plebbit_installer_win32_x64.exe#/dl.7z"
            }
        }
    }
}
