{
    "version": "0.9.9",
    "description": "Free and open source application for reading manga, novels, and watching animes available on Android, iOS, macOS, Linux and Windows",
    "homepage": "https://github.com/kodjodevf/mangayomi",
    "license": "Apache-2.0",
    "url": "https://github.com/kodjodevf/mangayomi/releases/download/v0.9.9/Mangayomi-v0.9.9-windows.zip",
    "hash": "dbfa14dc5106c695576a9a61c0c22a721652b52c39be63442b8e1edd83df37ce",
    "shortcuts": [
        [
            "mangayomi.exe",
            "Mangayomi"
        ]
    ],
    "checkver": "github",
    "autoupdate": {
        "url": "https://github.com/kodjodevf/mangayomi/releases/download/v$version/Mangayomi-v$version-windows.zip"
    }
}
