{
 "bin": [
  "php.exe",
  "php-cgi.exe"
 ],
 "env_set": {
  "PHP_INI_SCAN_DIR": "$persist_dir;$dir\\conf.d;"
 },
 "hash": "fc3fa03e2824c09ccbc59a9b84b6d1d03e1ff29bd238206f25358ed75554e026",
 "homepage": "http://windows.php.net",
 "license": "http://www.php.net/license/3_01.txt",
 "persist": [
  "conf.d"
 ],
 "post_install": "iex(gc $bucketsdir\\$bucket\\bin\\postinstall.ps1 -Raw)",
 "url": "http://museum.php.net/php5/php-5.2.2-Win32.zip",
 "version": "5.2.2"
}