{
  "homepage": "https://windows.php.net/downloads/releases/archives",
  "version": "5.6.15",
  "license": {
    "identifier": "PHP-3.01",
    "url": "https://www.php.net/license/"
  },
  "architecture": {
    "64bit": {
      "url": "https://windows.php.net/downloads/releases/archives/php-5.6.15-nts-Win32-VC11-x64.zip",
      "hash": "81fcb40baaec4d496aa300cdef62d3007af83b4d9a41e88f9eb545c61e3a115a"
    },
    "32bit": {
      "url": "https://windows.php.net/downloads/releases/archives/php-5.6.15-nts-Win32-VC11-x86.zip",
      "hash": "560c3ffd3a4bbe2679859e40ee4d7dbacfacb0c25e1ebc9f5be822412defbacc"
    }
  },
  "bin": [
    "php.exe",
    "php-cgi.exe"
  ],
  "persist": "conf.d",
  "env_set": {
    "PHP_INI_SCAN_DIR": "$persist_dir;$dir\\conf.d;"
  },
  "post_install": "if($bucket) { . \"$(Find-BucketDirectory $bucket\\bin\\postinstall.ps1)\" -dir \"$dir\" }",
  "suggest": {
    "vcredist": "extras/vcredist2012"
  }
}