{
    "version": "0.2.4",
    "description": "利用MITM技术实现请求和返回的重写、重定向、阻断等操作",
    "homepage": "https://github.com/zu1k/good-mitm",
    "license": "MIT",
    "architecture": {
        "64bit": {
            "url": "https://github.com/zu1k/good-mitm/releases/download/0.2.4/good-mitm-x86_64-pc-windows-gnu-0.2.4.zip",
            "hash": "81d0fac27f07270174da935af1f5a37cdc272a2e83f51d6de0f1c7fbad36c127"
        }
    },
    "extract_dir": "bin",
    "pre_install": "Get-ChildItem \"$dir\" 'good-mitm-*.exe' | Select-Object -First 1 | Rename-Item -NewName 'good-mitm.exe'",
    "bin": "good-mitm.exe",
    "checkver": "github",
    "autoupdate": {
        "architecture": {
            "64bit": {
                "url": "https://github.com/zu1k/good-mitm/releases/download/$version/good-mitm-x86_64-pc-windows-gnu-$version.zip"
            }
        }
    }
}
