{
    "version": "1.8.5",
    "description": "A Qt/C++ GUI front end to sshfs, ecryptfs-simple, cryfs, gocryptfs, securefs, fscrypt and encfs.",
    "homepage": "https://mhogomchungu.github.io/sirikali/",
    "license": "GPL-2.0-or-later",
    "architecture": {
        "64bit": {
            "url": "https://github.com/mhogomchungu/sirikali/releases/download/1.8.5/SiriKaliQt6-1.8.5.zip",
            "hash": "18682c37204ef8e77006093019112ce84bb82b270775b57ddb6d3ac9cef2ef47"
        }
    },
    "##": "see installer options here - https://jrsoftware.org/ishelp/index.php?topic=setupcmdline",
    "bin": "sirikali.exe",
    "depends": "nonportable/sshfs-np",
    "checkver": {
        "github": "https://github.com/mhogomchungu/sirikali"
    },
    "autoupdate": {
        "architecture": {
            "64bit": {
                "url": "https://github.com/mhogomchungu/sirikali/releases/download/$version/SiriKaliQt6-$version.zip"
            }
        }
    }
}
