{
    "version": "2.8.0.0",
    "homepage": "https://github.com/weespin/KhinsiderDownloader",
    "description": "A simple Bulk Khinsider downloader with a GUI.",
    "license": "MIT",
    "url": "https://github.com/weespin/KhinsiderDownloader/releases/download/2.8.0.0/Release.zip",
    "hash": "5111772a574553665413aec33b1dabba5b1b83e1a1e53b73218d190cacf45fde",
    "shortcuts": [
        [
            "KhinsiderDownloader.exe",
            "KhinsiderDownloader"
        ]
    ],
    "persist": "Downloads",
    "checkver": "github",
    "autoupdate": {
        "url": "https://github.com/weespin/KhinsiderDownloader/releases/download/$version/Release.zip"
    }
}
