{
    "version": "9.2.3435.1",
    "description": "FileLocator Pro 是一款高性能、专业的文件搜索工具。",
    "homepage": "https://www.mythicsoft.com/filelocatorpro/",
    "license": {
        "identifier": "Shareware",
        "url": "https://www.mythicsoft.com/filelocatorpro/buy/"
    },
    "url": [
        "https://download.mythicsoft.com/flp/3435/filelocator_inx64_3435.exe#/filelocator_inx64.exe",
        "https://github.com/maboloshi/scoop-private/releases/download/v1.0/FileLocatorPro-CrackPatch-v9.2.3435.1.zip"
    ],
    "hash": [
        "d2f21b187a2abd0304d5a7f16ddf88d02a035b120fe85ef24571f450350a02c2",
        "a639cc8fb8071d7c89f29300fb9cf13680c34815cd5c2697639f8ab311903dad"
    ],
    "extract_to": [
        "",
        "patch"
    ],
    "innosetup": true,
    "pre_install": [
        "ensure \"$persist_dir\\config\" | Out-Null",
        "@('config_v9.xml', 'history.xml', 'index.xml') | ForEach-Object { if (!(Test-Path \"$persist_dir\\config\\$_\")) { New-Item -Path \"$persist_dir\\config\\$_\" -ItemType File | Out-Null } }"
    ],
    "post_install": [
        "Write-Host `r`n'Applying crack patch...' -Foreground DarkCyan",
        "Copy-Item -Path \"$dir\\patch\\*\" -Destination \"$dir\" -Force -Recurse",
        "Remove-Item -Path \"$dir\\patch\" -Force -Recurse"
    ],
    "bin": "FileLocatorPro.exe",
    "shortcuts": [
        [
            "FileLocatorPro.exe",
            "FileLocator Pro"
        ]
    ],
    "persist": [
        "config\\config_v9.xml",
        "config\\history.xml",
        "config\\index.xml"
    ]
}
