{
    "version": "4.0.0",
    "description": "GUI prototyping tool",
    "homepage": "https://pencil.evolus.vn",
    "license": "GPL-2.0-only",
    "url": "https://pencil.evolus.vn/dl/V4.0.0.ga/Pencil-4.0.0.ga.exe#/dl.7z",
    "hash": "19dd56fbcdeecf66def18ec6766f4796127aedf2342798c48cde2e74bef498f0",
    "architecture": {
        "64bit": {
            "pre_install": "Expand-7zipArchive \"$dir\\`$PLUGINSDIR\\app-64.7z\" \"$dir\""
        },
        "32bit": {
            "pre_install": "Expand-7zipArchive \"$dir\\`$PLUGINSDIR\\app-32.7z\" \"$dir\""
        }
    },
    "post_install": "Remove-Item \"$dir\\`$*\" -Force -Recurse",
    "bin": "Pencil.exe",
    "shortcuts": [
        [
            "Pencil.exe",
            "Pencil"
        ]
    ],
    "checkver": {
        "github": "https://github.com/evolus/pencil"
    },
    "autoupdate": {
        "url": "https://pencil.evolus.vn/dl/V$version.ga/Pencil-$version.ga.exe#/dl.7z",
        "hash": {
            "url": "$baseurl/CHECKSUM"
        }
    }
}
