{
    "version": "0.6.0",
    "description": "A cross-platform Rust reimplementation of GNU diffutils (binaries compiled with MSVC), with some options or behaviors potentially differing from GNU diffutils.",
    "homepage": "https://uutils.github.io/diffutils/",
    "license": {
        "identifier": "MIT OR Apache-2.0",
        "url": "https://github.com/uutils/diffutils/blob/HEAD/LICENSE-MIT"
    },
    "suggest": {
        "vcredist": "extras/vcredist2022"
    },
    "architecture": {
        "64bit": {
            "url": "https://github.com/uutils/diffutils/releases/download/v0.6.0/diffutils-x86_64-pc-windows-msvc.zip",
            "hash": "69063ab317b737314ac509a1db0edee4be0b75892ac098969104103d9748e413"
        }
    },
    "bin": [
        "diffutils.exe",
        [
            "diffutils.exe",
            "cmp",
            "cmp"
        ],
        [
            "diffutils.exe",
            "diff",
            "diff"
        ],
        [
            "diffutils.exe",
            "diff3",
            "diff3"
        ],
        [
            "diffutils.exe",
            "sdiff",
            "sdiff"
        ]
    ],
    "checkver": {
        "github": "https://github.com/uutils/diffutils"
    },
    "autoupdate": {
        "architecture": {
            "64bit": {
                "url": "https://github.com/uutils/diffutils/releases/download/v$version/diffutils-x86_64-pc-windows-msvc.zip"
            }
        }
    }
}
