{
    "description": " A fake log generator for common log formats such as apache-common, apache error and RFC3164 syslog.",
    "homepage": "https://github.com/mingrammer/flog",
    "version": "0.3.2",
    "license": "MIT",
    "architecture": {
        "64bit": {
            "url": "https://github.com/mingrammer/flog/releases/download/v0.3.2/flog_0.3.2_windows_amd64.tar.gz",
            "hash": "a7a1d35623df3754dffbd0de9e4c5b46d25721fbd5d7eca16ab5a4eaf510f8e1"
        }
    },
    "bin": "flog.exe",
    "checkver": "github",
    "autoupdate": {
        "architecture": {
            "64bit": {
                "url": "https://github.com/mingrammer/flog/releases/download/v$version/flog_$version_windows_amd64.tar.gz",
                "hash": {
                    "url": "$baseurl/flog_$version_checksums.txt"
                }
            }
        }
    }
}
